trial_id,filler_or_item_id,location_condition,agent_in_picture,agent_in_question,verb_in_picture,verb_in_question,patient_in_picture,patient_in_question,picture_file,question_file,answer_script,question_script
01,item_01,Verb,Kimmy,Kimmy,Kick,Pull,Tommy,Tommy,KimmyIsKickingTommy.png,IsKimmyPullingTommy.wav,no Kimmy is kicking Tommy,is Kimmy pulling Tommy
02,item_01,Verb,Kimmy,Kimmy,Kick,Kiss,Tommy,Tommy,KimmyIsKickingTommy.png,IsKimmyKissingTommy.wav,no Kimmy is kicking Tommy,is Kimmy kissing Tommy
03,item_01,Control,Kimmy,Kimmy,Kick,Kick,Tommy,Tommy,KimmyIsKickingTommy.png,IsKimmyKickingTommy.wav,yes Kimmy is kicking Tommy,is Kimmy kicking Tommy
04,item_01,Control,Kimmy,Kimmy,Kick,Kick,Tommy,Tommy,KimmyIsKickingTommy.png,IsKimmyKickingTommy.wav,yes Kimmy is kicking Tommy,is Kimmy kicking Tommy
05,item_02,Verb,Bonnie,Bonnie,Kiss,Push,Benny,Benny,BonnieIsKissingBenny.png,IsBonniePushingBenny.wav,no Bonnie is kissing Benny,is Bonnie pushing Benny
06,item_02,Verb,Bonnie,Bonnie,Kiss,Kick,Benny,Benny,BonnieIsKissingBenny.png,IsBonnieKickingBenny.wav,no Bonnie is kissing Benny,is Bonnie kicking Benny
07,item_02,Control,Bonnie,Bonnie,Kiss,Kiss,Benny,Benny,BonnieIsKissingBenny.png,IsBonnieKissingBenny.wav,yes Bonnie is kissing Benny,is Bonnie kissing Benny
08,item_02,Control,Bonnie,Bonnie,Kiss,Kiss,Benny,Benny,BonnieIsKissingBenny.png,IsBonnieKissingBenny.wav,yes Bonnie is kissing Benny,is Bonnie kissing Benny
09,item_03,Verb,Joey,Joey,Push,Lift,Kerry,Kerry,JoeyIsPushingKerry.png,IsJoeyLiftingKerry.wav,no Joey is pushing Kerry,is Joey lifting Kerry
10,item_03,Verb,Joey,Joey,Push,Lift,Kerry,Kerry,JoeyIsPushingKerry.png,IsJoeyLiftingKerry.wav,no Joey is pushing Kerry,is Joey lifting Kerry
11,item_03,Control,Joey,Joey,Push,Push,Kerry,Kerry,JoeyIsPushingKerry.png,IsJoeyPushingKerry.wav,yes Joey is pushing Kerry,is Joey pushing Kerry
12,item_03,Control,Joey,Joey,Push,Push,Kerry,Kerry,JoeyIsPushingKerry.png,IsJoeyPushingKerry.wav,yes Joey is pushing Kerry,is Joey pushing Kerry
13,item_04,Verb,Kelly,Kelly,Pull,Push,Judy,Judy,KellyIsPullingJudy.png,IsKellyPushingJudy.wav,no Kelly is pulling Judy,is Kelly pushing Judy
14,item_04,Verb,Kelly,Kelly,Pull,Poke,Judy,Judy,KellyIsPullingJudy.png,IsKellyPokingJudy.wav,no Kelly is pulling Judy,is Kelly poking Judy
15,item_04,Control,Kelly,Kelly,Pull,Pull,Judy,Judy,KellyIsPullingJudy.png,IsKellyPullingJudy.wav,yes Kelly is pulling Judy,is Kelly pulling Judy
16,item_04,Control,Kelly,Kelly,Pull,Pull,Judy,Judy,KellyIsPullingJudy.png,IsKellyPullingJudy.wav,yes Kelly is pulling Judy,is Kelly pulling Judy
17,filler_01,Verb,Cindy,Cindy,Push,Pull,Betty,Betty,CindyIsPushingBetty.png,IsCindyPullingBetty.wav,no Cindy is pushing Betty,is Cindy pulling Betty
18,filler_02,Verb,Henry,Henry,Poke,Lift,Ollie,Ollie,HenryIsPokingOllie.png,IsHenryLiftingOllie.wav,no Henry is poking Ollie,is Henry lifting Ollie
19,filler_03,Verb,Teddy,Teddy,Lift,Push,Molly,Molly,TeddyIsLiftingMolly.png,IsTeddyPushingMolly.wav,no Teddy is lifting Molly,is Teddy pushing Molly
20,filler_04,Verb,Brandy,Brandy,Poke,Kiss,Johnny,Johnny,BrandyIsPokingJohnny.png,IsBrandyKissingJohnny.wav,no Brandy is poking Johnny,is Brandy kissing Johnny
21,filler_05,Verb,Betty,Betty,Poke,Kick,Harvey,Harvey,BettyIsPokingHarvey.png,IsBettyKickingHarvey.wav,no Betty is poking Harvey,is Betty kicking Harvey
22,filler_06,Verb,Henry,Henry,Pull,Lift,Ronnie,Ronnie,HenryIsPullingRonnie.png,IsHenryLiftingRonnie.wav,no Henry is pulling Ronnie,is Henry lifting Ronnie
23,filler_07,Verb,Cindy,Cindy,Push,Pull,Lilly,Lilly,CindyIsPushingLilly.png,IsCindyPullingLilly.wav,no Cindy is pushing Lilly,is Cindy pulling Lilly
24,filler_08,Verb,Mindy,Mindy,Lift,Kiss,Danny,Danny,MindyIsLiftingDanny.png,IsMindyKissingDanny.wav,no Mindy is lifting Danny,is Mindy kissing Danny
25,filler_09,Verb,Nancy,Nancy,Poke,Kiss,Ollie,Ollie,NancyIsPokingOllie.png,IsNancyKissingOllie.wav,no Nancy is poking Ollie,is Nancy kissing Ollie
26,filler_10,Verb,Molly,Molly,Push,Kick,Percy,Percy,MollyIsPushingPercy.png,IsMollyKickingPercy.wav,no Molly is pushing Percy,is Molly kicking Percy
27,filler_11,Verb,Ronnie,Ronnie,Kiss,Push,Brandy,Brandy,RonnieIsKissingBrandy.png,IsRonniePushingBrandy.wav,no Ronnie is kissing Brandy,is Ronnie pushing Brandy
28,filler_12,Verb,Tracy,Tracy,Poke,Pull,Cindy,Cindy,TracyIsPokingCindy.png,IsTracyPullingCindy.wav,no Tracy is poking Cindy,is Tracy pulling Cindy
29,filler_13,Verb,Harvey,Harvey,Kick,Push,Sally,Sally,HarveyIsKickingSally.png,IsHarveyPushingSally.wav,no Harvey is kicking Sally,is Harvey pushing Sally
30,filler_14,Verb,Chloe,Chloe,Kiss,Kick,Gary,Gary,ChloeIsKissingGary.png,IsChloeKickingGary.wav,no Chloe is kissing Gary,is Chloe kicking Gary
31,filler_15,Verb,Laurie,Laurie,Lift,Poke,Carlie,Carlie,LaurieIsLiftingCarlie.png,IsLauriePokingCarlie.wav,no Laurie is lifting Carlie,is Laurie poking Carlie
32,filler_16,Verb,Percy,Percy,Kick,Push,Molly,Molly,PercyIsKickingMolly.png,IsPercyPushingMolly.wav,no Percy is kicking Molly,is Percy pushing Molly
33,filler_17,Verb,Lacey,Lacey,Poke,Pull,Tracy,Tracy,LaceyIsPokingTracy.png,IsLaceyPullingTracy.wav,no Lacey is poking Tracy,is Lacey pulling Tracy
34,filler_18,Verb,Mandy,Mandy,Push,Poke,Lacey,Lacey,MandyIsPushingLacey.png,IsMandyPokingLacey.wav,no Mandy is pushing Lacey,is Mandy poking Lacey
35,filler_19,Verb,Henry,Henry,Pull,Push,Brandy,Brandy,HenryIsPullingBrandy.png,IsHenryPushingBrandy.wav,no Henry is pulling Brandy,is Henry pushing Brandy
36,filler_20,Verb,Danny,Danny,Pull,Lift,Henry,Henry,DannyIsPullingHenry.png,IsDannyLiftingHenry.wav,no Danny is pulling Henry,is Danny lifting Henry
37,filler_21,Verb,Johnny,Johnny,Kick,Push,Chloe,Chloe,JohnnyIsKickingChloe.png,IsJohnnyPushingChloe.wav,no Johnny is kicking Chloe,is Johnny pushing Chloe
38,filler_22,Verb,Lacey,Lacey,Lift,Poke,Brandy,Brandy,LaceyIsLiftingBrandy.png,IsLaceyPokingBrandy.wav,no Lacey is lifting Brandy,is Lacey poking Brandy
39,filler_23,Verb,Kenny,Kenny,Poke,Push,Tracy,Tracy,KennyIsPokingTracy.png,IsKennyPushingTracy.wav,no Kenny is poking Tracy,is Kenny pushing Tracy
40,filler_24,Verb,Jenny,Jenny,Push,Pull,Vicky,Vicky,JennyIsPushingVicky.png,IsJennyPullingVicky.wav,no Jenny is pushing Vicky,is Jenny pulling Vicky
41,filler_25,Verb,Jenny,Jenny,Lift,Poke,Mindy,Mindy,JennyIsLiftingMindy.png,IsJennyPokingMindy.wav,no Jenny is lifting Mindy,is Jenny poking Mindy
42,filler_26,Verb,Ollie,Ollie,Kiss,Push,Hailey,Hailey,OllieIsKissingHailey.png,IsOlliePushingHailey.wav,no Ollie is kissing Hailey,is Ollie pushing Hailey
43,filler_27,Verb,Sally,Sally,Push,Kick,Harvey,Harvey,SallyIsPushingHarvey.png,IsSallyKickingHarvey.wav,no Sally is pushing Harvey,is Sally kicking Harvey
44,filler_28,Verb,Jenny,Jenny,Push,Kick,Johnny,Johnny,JennyIsPushingJohnny.png,IsJennyKickingJohnny.wav,no Jenny is pushing Johnny,is Jenny kicking Johnny
45,filler_29,Verb,Nancy,Nancy,Kick,Kiss,Jimmy,Jimmy,NancyIsKickingJimmy.png,IsNancyKissingJimmy.wav,no Nancy is kicking Jimmy,is Nancy kissing Jimmy
46,filler_30,Verb,Lilly,Lilly,Lift,Pull,Brandy,Brandy,LillyIsLiftingBrandy.png,IsLillyPullingBrandy.wav,no Lilly is lifting Brandy,is Lilly pulling Brandy
47,filler_31,Verb,Chloe,Chloe,Push,Kick,Henry,Henry,ChloeIsPushingHenry.png,IsChloeKickingHenry.wav,no Chloe is pushing Henry,is Chloe kicking Henry
48,filler_32,Verb,Betty,Betty,Push,Kick,Danny,Danny,BettyIsPushingDanny.png,IsBettyKickingDanny.wav,no Betty is pushing Danny,is Betty kicking Danny
49,filler_33,Verb,Betty,Betty,Push,Pull,Carlie,Carlie,BettyIsPushingCarlie.png,IsBettyPullingCarlie.wav,no Betty is pushing Carlie,is Betty pulling Carlie
50,filler_34,Verb,Franny,Franny,Poke,Kick,Jerry,Jerry,FrannyIsPokingJerry.png,IsFrannyKickingJerry.wav,no Franny is poking Jerry,is Franny kicking Jerry
51,filler_35,Verb,Lilly,Lilly,Poke,Kick,Davey,Davey,LillyIsPokingDavey.png,IsLillyKickingDavey.wav,no Lilly is poking Davey,is Lilly kicking Davey
52,filler_36,Verb,Vicky,Vicky,Push,Kiss,Jimmy,Jimmy,VickyIsPushingJimmy.png,IsVickyKissingJimmy.wav,no Vicky is pushing Jimmy,is Vicky kissing Jimmy
53,filler_37,Verb,Freddy,Freddy,Poke,Push,Brandy,Brandy,FreddyIsPokingBrandy.png,IsFreddyPushingBrandy.wav,no Freddy is poking Brandy,is Freddy pushing Brandy
54,filler_38,Verb,Sally,Sally,Kiss,Kick,Ronnie,Ronnie,SallyIsKissingRonnie.png,IsSallyKickingRonnie.wav,no Sally is kissing Ronnie,is Sally kicking Ronnie
55,filler_39,Verb,Brandy,Brandy,Kick,Kiss,Jerry,Jerry,BrandyIsKickingJerry.png,IsBrandyKissingJerry.wav,no Brandy is kicking Jerry,is Brandy kissing Jerry
56,filler_40,Verb,Chloe,Chloe,Kick,Kiss,Sammy,Sammy,ChloeIsKickingSammy.png,IsChloeKissingSammy.wav,no Chloe is kicking Sammy,is Chloe kissing Sammy
57,filler_41,Verb,Carlie,Carlie,Lift,Pull,Mandy,Mandy,CarlieIsLiftingMandy.png,IsCarliePullingMandy.wav,no Carlie is lifting Mandy,is Carlie pulling Mandy
58,filler_42,Verb,Jerry,Jerry,Pull,Lift,Timmy,Timmy,JerryIsPullingTimmy.png,IsJerryLiftingTimmy.wav,no Jerry is pulling Timmy,is Jerry lifting Timmy
59,filler_43,Verb,Kylie,Kylie,Push,Poke,Mindy,Mindy,KylieIsPushingMindy.png,IsKyliePokingMindy.wav,no Kylie is pushing Mindy,is Kylie poking Mindy
60,filler_44,Verb,Brandy,Brandy,Push,Kick,Jerry,Jerry,BrandyIsPushingJerry.png,IsBrandyKickingJerry.wav,no Brandy is pushing Jerry,is Brandy kicking Jerry
61,filler_45,Verb,Franny,Franny,Lift,Kiss,Percy,Percy,FrannyIsLiftingPercy.png,IsFrannyKissingPercy.wav,no Franny is lifting Percy,is Franny kissing Percy
62,filler_46,Verb,Jimmy,Jimmy,Poke,Lift,Wally,Wally,JimmyIsPokingWally.png,IsJimmyLiftingWally.wav,no Jimmy is poking Wally,is Jimmy lifting Wally
63,filler_47,Verb,Laurie,Laurie,Lift,Pull,Tori,Tori,LaurieIsLiftingTori.png,IsLauriePullingTori.wav,no Laurie is lifting Tori,is Laurie pulling Tori
64,filler_48,Verb,Hailey,Hailey,Lift,Kick,Teddy,Teddy,HaileyIsLiftingTeddy.png,IsHaileyKickingTeddy.wav,no Hailey is lifting Teddy,is Hailey kicking Teddy
65,filler_49,Verb,Sally,Sally,Poke,Kick,Timmy,Timmy,SallyIsPokingTimmy.png,IsSallyKickingTimmy.wav,no Sally is poking Timmy,is Sally kicking Timmy
66,filler_50,Verb,Jimmy,Jimmy,Poke,Lift,Sammy,Sammy,JimmyIsPokingSammy.png,IsJimmyLiftingSammy.wav,no Jimmy is poking Sammy,is Jimmy lifting Sammy
67,filler_51,Verb,Kenny,Kenny,Kiss,Push,Cindy,Cindy,KennyIsKissingCindy.png,IsKennyPushingCindy.wav,no Kenny is kissing Cindy,is Kenny pushing Cindy
68,filler_52,Verb,Sally,Sally,Lift,Kiss,Harvey,Harvey,SallyIsLiftingHarvey.png,IsSallyKissingHarvey.wav,no Sally is lifting Harvey,is Sally kissing Harvey
69,filler_53,Verb,Carrie,Carrie,Push,Kick,Danny,Danny,CarrieIsPushingDanny.png,IsCarrieKickingDanny.wav,no Carrie is pushing Danny,is Carrie kicking Danny
70,filler_54,Verb,Teddy,Teddy,Pull,Lift,Timmy,Timmy,TeddyIsPullingTimmy.png,IsTeddyLiftingTimmy.wav,no Teddy is pulling Timmy,is Teddy lifting Timmy
71,filler_55,Verb,Timmy,Timmy,Lift,Push,Mandy,Mandy,TimmyIsLiftingMandy.png,IsTimmyPushingMandy.wav,no Timmy is lifting Mandy,is Timmy pushing Mandy
72,filler_56,Verb,Chloe,Chloe,Push,Poke,Brandy,Brandy,ChloeIsPushingBrandy.png,IsChloePokingBrandy.wav,no Chloe is pushing Brandy,is Chloe poking Brandy
